"reference";"name";"price";"description";"description_short";"meta_title";"meta_keywords";"meta_description"
"BO31UNJ.POW";"Vêtement Bébé Fille Princesse Un Jour - PETIT DEMON";"22.900000";"<p class=""p1""><img src=""https://www.petitdemon.fr/img/cms/BANDEAU-bio-fabrication-franc%CC%A7aise-oekotex-copie-copie.jpg"" alt=""BANDEAU-bio-fabrication-française-oekotex"" width=""1198"" height=""170"" /></p> <hr /><h3><span><strong>100% COTON BIOLOGIQUE. LABEL GOTS</strong>   </span></h3> <h3><span>(Global Organic Textile Standard).</span></h3> <h3 class=""p1""><span class=""s1"">Coton très épais 200 Mg, maille tissu très resserrée.  </span></h3> <p class=""p2""></p> <h3 class=""p1""><span class=""s1"">Trois pressions à l'entrejambe sans nickel<br />Emmanchures américaines</span></h3> <h3 class=""p1""><span class=""s1"">Nos bodies sont réalisés avec <strong>un coton BIO</strong>, épais, très doux. Un tissu de qualité afin de préserver la peau fragile des bébés.               </span></h3> <p></p> <h3 class=""p1""><strong>Body testé sans substance nocive, ni métaux lourds. </strong></h3> <p></p> <h3 class=""p1""><strong>Encre à l´eau de fabrication française, certifié OEKO TEX.</strong></h3> <hr /><p><strong>Le référentiel Global Organic Textile Standard (GOTS)</strong> est le fruit d'une collaboration entre les principaux acteurs dans le domaine de la normalisation ayant pour but de définir des exigences reconnues dans le monde entier et permettant ainsi de garantir la qualité biologique des textiles depuis la récolte des matières premières, en passant par la fabrication responsable d'un point de vue social et environnemental, jusqu'à l'étiquetage pour offrir une garantie fiable au consommateur.</p> <h3 class=""p1""><span class=""s1"">source : de Global Organic Textile Standard International Working Group</span> </h3> <hr /><p><span> </span> <img src=""https://www.petitdemon.fr/img/cms/lavage%20a%2030.gif"" alt=""lavage a 30"" width=""29"" height=""23"" />Lavage machine 30°     <img src=""https://www.petitdemon.fr/img/cms/sechage.gif"" alt=""sechage"" width=""29"" height=""23"" />ne pas sécher à la machine      <img src=""https://www.petitdemon.fr/img/cms/repassage%20a%CC%80%202.gif"" alt=""repassage à 2"" width=""30"" height=""23"" />repassage à l'envers, température inférieure à 150° C </p>";"<p class=""&quot;p1&quot;""><span style=""color:#2c9ffd;""><span class=""&quot;s1&quot;""><strong><img src=""https://www.petitdemon.fr/img/cms/banniere%20envois%20gratis%20copie.jpg"" alt=""livraison gratuite - petit demon"" width=""300"" height=""47"" /></strong></span></span></p> <h2 class=""&quot;p1&quot;""><span style=""color:#2c9ffd;""><span class=""&quot;s1&quot;""><strong>Body</strong> bébé <strong>original</strong> fille Princesse</span></span></h2> <h3 class=""&quot;p2&quot;""><span class=""&quot;s1&quot;"">Avec ce body <strong>humour</strong> princesse, le ton est donné. Les futurs prétendants sont prévenus.</span></h3> <h3>En coffret de naissance, ce body original se doit de composer la garde robe d'une Princesse Royale </h3> <h3 class=""&quot;p2&quot;""><span style=""color:#f3847f;"">LE PETIT PLUS : BODY BEBE BIO Certifié OEKO TEX. Création Française, modèle unique.</span></h3>";"Body bébé message papa | CRÉATION FRANÇAISE| PETIT DEMON";"body bebe,cadeau de naissance,body princesse,body princesse papa,body bebe original,body bebe drole,body humour,body bébé original,body bebe original,body bébé drôle,body un jour mon prince viendra et mon pere le fracassera,body bebe princesse";"Parfait cadeau de naissance original pour papa ce body ""Un Jour Mon Prince Viendra et Mon Père le Fracassera"" | Label OekoTex |LIVRAISON GRATUITE "
"BO40NOTICE.BG";"Body Bébé Humour pour papa Notice pour papa - PETIT DEMON";"22.900000";"<p class=""p1""><img src=""https://www.petitdemon.fr/img/cms/BANDEAU-bio-fabrication-franc%CC%A7aise-oekotex-copie-copie.jpg"" alt=""BANDEAU-bio-fabrication-française-oekotex"" width=""1198"" height=""170"" /></p> <hr /><h3><span><strong>100% COTON BIOLOGIQUE. LABEL GOTS</strong>   </span></h3> <h3><span>(Global Organic Textile Standard).</span></h3> <h3 class=""p1""><span class=""s1"">Coton très épais 200 Mg, maille tissu très resserrée.  </span></h3> <p class=""p2""></p> <h3 class=""p1""><span class=""s1"">Trois pressions à l'entrejambe sans nickel<br />Emmanchures américaines</span></h3> <h3 class=""p1""><span class=""s1"">Nos bodies sont réalisés avec <strong>un coton BIO</strong>, épais, très doux. Un tissu de qualité afin de préserver la peau fragile des bébés.               </span></h3> <p></p> <h3 class=""p1""><strong>Body testé sans substance nocive, ni métaux lourds. </strong></h3> <p></p> <h3 class=""p1""><strong>Encre à l´eau de fabrication française, certifié OEKO TEX.</strong></h3> <hr /><p><strong>Le référentiel Global Organic Textile Standard (GOTS)</strong> est le fruit d'une collaboration entre les principaux acteurs dans le domaine de la normalisation ayant pour but de définir des exigences reconnues dans le monde entier et permettant ainsi de garantir la qualité biologique des textiles depuis la récolte des matières premières, en passant par la fabrication responsable d'un point de vue social et environnemental, jusqu'à l'étiquetage pour offrir une garantie fiable au consommateur.</p> <h3 class=""p1""><span class=""s1"">source : de Global Organic Textile Standard International Working Group</span> </h3> <hr /><p><span> </span> <img src=""https://www.petitdemon.fr/img/cms/lavage%20a%2030.gif"" alt=""lavage a 30"" width=""29"" height=""23"" />Lavage machine 30°     <img src=""https://www.petitdemon.fr/img/cms/sechage.gif"" alt=""sechage"" width=""29"" height=""23"" />ne pas sécher à la machine      <img src=""https://www.petitdemon.fr/img/cms/repassage%20a%CC%80%202.gif"" alt=""repassage à 2"" width=""30"" height=""23"" />repassage à l'envers, température inférieure à 150° C </p>";"<h2 class=""p1""><span style=""color:#d0121a;"">Un <strong>body</strong> bébé <strong>humour</strong> pour papa</span></h2> <h3 class=""p1""><span class=""s1"">On a réalisé pour vous, le body qui va réconcilier les papas avec le change des bébés. </span></h3> <h2 class=""p2""><span class=""s1"">Attention! Humour des papas à prendre en considération. </span></h2> <h2 class=""p1""><span class=""s1"">Ce body bébé humour est une idée cadeau de naissance original.</span></h2> <h2 class=""p1""><span class=""s1"" style=""color:#d0121a;"">LE PETIT PLUS : body bébé Bio certifié GOTS. Création française, modèle unique</span></h2> <h1 class=""p1""><span class=""s1"" style=""color:#fbe329;""> </span></h1>";"Body bébé humour notice pour papa | CRÉATION FRANÇAISE| PETIT DEMON";;"Faites plaisir à papa en offrant ce body spécial papa. Un cadeau de naissance rigolo, un body plein d'humour | Label OekoTex | LIVRAISON GRATUITE "
"BODY FACEBOOK";"Body Bébé Facebook";"12.500000";"<p><span style=""font-size:12pt;""><strong><span style=""font-family:tahoma, arial, helvetica, sans-serif;color:#000000;"">BODY JE NE VEUX PAS ETRE SUR FACEBOOK</span></strong></span></p> <hr /><p><span style=""font-family:tahoma, arial, helvetica, sans-serif;color:#000000;""> </span></p> <p class=""p1""><span class=""s1"" style=""color:#000000;"">Body naissance - Body bébé original </span></p> <p class=""p1""><span class=""s1"" style=""color:#000000;"">100% PUR COTON TOUT DOUX, TISSÉ EN 200g/m 2 (coton très épais)</span></p> <p class=""p1""><span class=""s1"" style=""color:#000000;"">Trois pressions à l'entrejambe<strong> sans nickel</strong><br /> Emmanchures américaines</span></p> <p class=""p2""></p> <p class=""p2""><span style=""color:#000000;""><em><span class=""s1""><strong>Certifié sans substance chimique ou nocive par le label TEXTILE OEKO-TEX 100</strong></span></em></span></p> <p><span style=""font-family:tahoma, arial, helvetica, sans-serif;font-size:10pt;line-height:1.5em;color:#000000;""> </span></p> <hr /><p><span style=""font-family:tahoma, arial, helvetica, sans-serif;color:#000000;font-size:10pt;""> </span></p> <p class=""p1""><span class=""s1"" style=""color:#000000;"">Nos bodies sont réalisés avec un coton épais, très doux, <strong>testés sans substance nocive ni produit chimique notoire.</strong> </span></p> <p class=""p1""><span class=""s1"" style=""color:#000000;"">Un tissu de qualité afin de préserver la peau fragile des bébés.</span></p> <p class=""p1""><span class=""s1"" style=""color:#000000;"">Nos bodies labelisés OEKO-TEX STANDARD 100 respectent l´environnement et le travail humain.</span></p> <p class=""p2""><span style=""color:#000000;""> </span></p> <p class=""p1""><span class=""s1"" style=""color:#000000;""><strong>Écologie humaine</strong></span></p> <p class=""p1""><span class=""s1"" style=""color:#000000;"">L'écologie humaine s`intéresse aux effets des textiles et de leurs composants chimiques sur la santé et le bien-être des personnes.</span></p> <p class=""p1""><span class=""s1"" style=""color:#000000;"">Source Oeko-tex</span></p> <p><span style=""font-family:tahoma, arial, helvetica, sans-serif;color:#000000;font-size:10pt;""> </span></p> <hr /><p><span style=""font-family:tahoma, arial, helvetica, sans-serif;color:#000000;font-size:10pt;""> </span></p> <p><span style=""font-family:tahoma, arial, helvetica, sans-serif;color:#000000;font-size:10pt;""> <a title=""Lavage machine 60°"" href=""http://www.vertbaudet.fr/page/guide-entretien.htm""><span style=""color:#000000;""><img title=""Lavage machine 30°"" src=""http://media.vertbaudet.fr/Medias/3-0-0/75/7/lavage_2-gif_m1076472233.gif"" alt=""Lavage machine 30°"" width=""29"" height=""23"" /></span></a> Lavage machine 30°    <a title=""séchage au séche linge 2 points"" href=""http://www.vertbaudet.fr/page/guide-entretien.htm""><span style=""color:#000000;""><img src=""http://media.vertbaudet.fr/Medias/3-0-0/75/7/sechage_3-gif_m-1358962856.gif"" alt="""" width=""29"" height=""23"" /></span></a> ne pas sécher à la machine     <a title=""Repassage température inférieure à 150° C"" href=""http://www.vertbaudet.fr/page/guide-entretien.htm""><span style=""color:#000000;""><img title=""Repassage température inférieure à 150° C"" src=""http://media.vertbaudet.fr/Pictos/3-0-0/trepas_2.gif"" alt=""Repassage température inférieure à 150° C"" /></span></a> repassage à l'envers, température inférieure à 150° C </span></p>";"<p><span style=""color:#136eeb;font-family:tahoma, arial, helvetica, sans-serif;font-size:12pt;""><strong>BODY BEBE JE NE VEUX PAS ETRE SUR FACEBOOK</strong></span></p> <p class=""Corps""><span style=""color:#3366ff;""><span style=""font-family:tahoma, arial, helvetica, sans-serif;font-size:10pt;""><strong>Spéciales revendications</strong></span><span style=""font-family:tahoma, arial, helvetica, sans-serif;font-size:12pt;line-height:1.5em;""> </span></span></p> <p class=""Corps""><span style=""font-family:tahoma, arial, helvetica, sans-serif;font-size:10pt;color:#000000;"">Un body drôle qui parle à la place des bébés.</span></p> <p class=""Corps""><span style=""font-family:tahoma, arial, helvetica, sans-serif;font-size:10pt;color:#000000;"">Même pas né que ma frimousse est déjà sur facebook. Mais a t-on demandé mon avis de bébé in utero.</span></p> <p class=""Corps""><span style=""font-family:tahoma, arial, helvetica, sans-serif;font-size:10pt;color:#000000;"">Avec ce body original papa maman vous êtes prévenus.</span></p> <p class=""Corps""><span style=""line-height:1.5em;font-family:tahoma, arial, helvetica, sans-serif;font-size:10pt;color:#000000;"">Ce body de naissance original est à porter à toutes occasions pour faire comprendre le message</span></p>";"Body bébé facebook";"body bébé,bodie bébé,body bebe,body bebe original,body bebe pour maman,body bebe drole,body bébé drole,cadeau naissance original,cadeau pour maman,cadeau fete des meres,cadeau fête des mères";"Body bébé Je ne veux pas être sur Facebook. Un body pour les plus réfractaires à afficher en long, la tête de leur petite progéniture sur facebook."
"BODY 100% PARFAITE FILLE";"Body Bébé 100% parfaite";"12.500000";"<p><span style=""font-size:12pt;""><strong><span style=""font-family:tahoma, arial, helvetica, sans-serif;color:#000000;"">BODY 100% PARFAITE</span></strong></span></p> <hr /><p><span style=""font-family:webdings;color:#000000;""> </span></p> <p class=""p1""><span class=""s1"" style=""color:#000000;"">Body naissance - Body bébé original </span></p> <p class=""p1""><span class=""s1"" style=""color:#000000;"">100% PUR COTON TOUT DOUX, TISSÉ EN 200g/m 2 (coton très épais)</span></p> <p class=""p1""><span class=""s1"" style=""color:#000000;"">Trois pressions à l'entrejambe<strong> sans nickel</strong><br /> Emmanchures américaines</span></p> <p class=""p2""><span style=""color:#000000;""> </span></p> <p class=""p3""><span style=""color:#000000;""><em><span class=""s1""><strong>Certifié sans substance chimique ou nocive par le label TEXTILE OEKO-TEX 100</strong></span></em></span></p> <p><span style=""font-family:webdings;font-size:10pt;color:#000000;""> </span></p> <hr /><p><span style=""font-family:webdings;font-size:10pt;color:#000000;""> </span></p> <p class=""p1""><span class=""s1"" style=""color:#000000;"">Nos bodies sont réalisés avec un coton épais, très doux, <strong>testés sans substance nocive ni produit chimique notoire.</strong> </span></p> <p class=""p1""><span class=""s1"" style=""color:#000000;"">Un tissu de qualité afin de préserver la peau fragile des bébés.</span></p> <p class=""p1""><span class=""s1"" style=""color:#000000;"">Nos bodies labelisés OEKO-TEX STANDARD 100 respectent l´environnement et le travail humain.</span></p> <p class=""p2""><span style=""color:#000000;""> </span></p> <p class=""p1""><span class=""s1"" style=""color:#000000;""><strong>Écologie humaine</strong></span></p> <p class=""p1""><span class=""s1"" style=""color:#000000;"">L'écologie humaine s`intéresse aux effets des textiles et de leurs composants chimiques sur la santé et le bien-être des personnes.</span></p> <p class=""p1""><span class=""s1"" style=""color:#000000;"">Source Oeko-tex</span></p> <p class=""p1""></p> <hr /><p><span style=""font-family:webdings;font-size:10pt;color:#000000;""> </span></p> <p><span style=""font-family:webdings;font-size:10pt;color:#000000;""> <a title=""Lavage machine 60°"" href=""http://www.vertbaudet.fr/page/guide-entretien.htm""><span style=""color:#000000;""><img title=""Lavage machine 30°"" src=""http://media.vertbaudet.fr/Medias/3-0-0/75/7/lavage_2-gif_m1076472233.gif"" alt=""Lavage machine 30°"" width=""29"" height=""23"" /></span></a> Lavage machine 30°    <a title=""séchage au séche linge 2 points"" href=""http://www.vertbaudet.fr/page/guide-entretien.htm""><span style=""color:#000000;""><img src=""http://media.vertbaudet.fr/Medias/3-0-0/75/7/sechage_3-gif_m-1358962856.gif"" alt="""" width=""29"" height=""23"" /></span></a> ne pas sécher à la machine     <a title=""Repassage température inférieure à 150° C"" href=""http://www.vertbaudet.fr/page/guide-entretien.htm""><span style=""color:#000000;""><img title=""Repassage température inférieure à 150° C"" src=""http://media.vertbaudet.fr/Pictos/3-0-0/trepas_2.gif"" alt=""Repassage température inférieure à 150° C"" /></span></a> repassage à l'envers, température inférieure à 150° C </span></p>";"<p><span style=""color:#eb775b;font-family:tahoma, arial, helvetica, sans-serif;font-size:12pt;""><strong>BODY BEBE 100% PARFAITE</strong></span></p> <p class=""Corps""><span style=""font-size:10pt;color:#33cccc;font-family:tahoma, arial, helvetica, sans-serif;""><strong>Cherche pas ya pas d´erreurs!</strong></span></p> <p class=""Corps""><span style=""font-family:tahoma, arial, helvetica, sans-serif;font-size:10pt;line-height:1.5em;color:#000000;"">Ce body original mettra tous les parents d´accord.</span></p> <p class=""Corps""><span style=""font-family:tahoma, arial, helvetica, sans-serif;font-size:10pt;color:#000000;"">Ne cherchez plus à qui je ressemble, c´est marqué sur mon body.</span></p> <p class=""Corps""><span style=""font-family:tahoma, arial, helvetica, sans-serif;font-size:10pt;color:#000000;"">Une petite fille modèle 100% fabrication parfaite.</span></p> <p class=""Corps""><span style=""font-family:tahoma, arial, helvetica, sans-serif;font-size:10pt;line-height:1.5em;color:#000000;"">Habillez votre bébé avec ce body original, aux couleurs douces.</span></p>";"Body bébé parfaite";"body bébé,bodie bébé,body bebe,body bebe original,body bebe pour maman,body bebe drole,body bébé drole,cadeau naissance original,cadeau pour maman";"Body bébé fille 100% Parfaite. Fabrication 100% parents parfaits pour ce body original. Un cadeau naissance sympa à offrir à la famille parfaite. "
"BODY 100% PARFAIT GARCON";"Body bébé 100% parfait";"12.500000";"<p><span style=""font-size:12pt;""><strong><span style=""color:#000000;font-family:tahoma, arial, helvetica, sans-serif;"">BODY 100% PARFAIT</span></strong></span></p> <hr /><p><span style=""font-size:10pt;color:#000000;""> </span></p> <p class=""p1""><span class=""s1"" style=""color:#000000;"">Body naissance - Body bébé original </span></p> <p class=""p1""><span class=""s1"" style=""color:#000000;"">100% PUR COTON TOUT DOUX, TISSÉ EN 200g/m 2 (coton très épais)</span></p> <p class=""p1""><span class=""s1"" style=""color:#000000;"">Trois pressions à l'entrejambe<strong> sans nickel</strong><br /> Emmanchures américaines</span></p> <p class=""p2""><span style=""color:#000000;""> </span></p> <p class=""p3""><span style=""color:#000000;""><em><span class=""s1""><strong>Certifié sans substance chimique ou nocive par le label TEXTILE OEKO-TEX 100</strong></span></em></span></p> <p><span style=""font-size:10pt;color:#000000;""> </span></p> <hr /><p><span style=""font-size:10pt;color:#000000;""> </span></p> <p class=""p1""><span class=""s1"" style=""color:#000000;"">Nos bodies sont réalisés avec un coton épais, très doux, <strong>testés sans substance nocive ni produit chimique notoire.</strong> </span></p> <p class=""p1""><span class=""s1"" style=""color:#000000;"">Un tissu de qualité afin de préserver la peau fragile des bébés.</span></p> <p class=""p1""><span class=""s1"" style=""color:#000000;"">Nos bodies labelisés OEKO-TEX STANDARD 100 respectent l´environnement et le travail humain.</span></p> <p class=""p2""><span style=""color:#000000;""> </span></p> <p class=""p1""><span class=""s1"" style=""color:#000000;""><strong>Écologie humaine</strong></span></p> <p class=""p1""><span class=""s1"" style=""color:#000000;"">L'écologie humaine s`intéresse aux effets des textiles et de leurs composants chimiques sur la santé et le bien-être des personnes.</span></p> <p class=""p1""><span class=""s1"" style=""color:#000000;"">Source Oeko-tex</span></p> <p><span style=""font-size:10pt;color:#000000;""> </span></p> <hr /><p><span style=""font-size:10pt;color:#000000;""> </span></p> <p><span style=""font-size:10pt;color:#000000;""> <a title=""Lavage machine 60°"" href=""http://www.vertbaudet.fr/page/guide-entretien.htm""><span style=""color:#000000;""><img title=""Lavage machine 30°"" src=""http://media.vertbaudet.fr/Medias/3-0-0/75/7/lavage_2-gif_m1076472233.gif"" alt=""Lavage machine 30°"" width=""29"" height=""23"" /></span></a> Lavage machine 30°    <a title=""séchage au séche linge 2 points"" href=""http://www.vertbaudet.fr/page/guide-entretien.htm""><span style=""color:#000000;""><img src=""http://media.vertbaudet.fr/Medias/3-0-0/75/7/sechage_3-gif_m-1358962856.gif"" alt="""" width=""29"" height=""23"" /></span></a> ne pas sécher à la machine     <a title=""Repassage température inférieure à 150° C"" href=""http://www.vertbaudet.fr/page/guide-entretien.htm""><span style=""color:#000000;""><img title=""Repassage température inférieure à 150° C"" src=""http://media.vertbaudet.fr/Pictos/3-0-0/trepas_2.gif"" alt=""Repassage température inférieure à 150° C"" /></span></a> repassage à l'envers, température inférieure à 150° C </span></p>";"<p><span style=""color:#0eacf0;font-size:12pt;font-family:tahoma, arial, helvetica, sans-serif;""><strong>BODY BEBE 100% PARFAIT</strong></span></p> <p class=""Corps""><span style=""color:#e82b45;font-size:10pt;font-family:tahoma, arial, helvetica, sans-serif;""><strong>Le meilleur des baby boys c´est moi</strong></span></p> <p class=""Corps""><span style=""font-size:10pt;line-height:1.5em;font-family:tahoma, arial, helvetica, sans-serif;color:#000000;"">Ce n´est plus un mythe, le bébé parfait existe bien...ne cherchez plus c´est moi.</span></p> <p class=""Corps""><span style=""font-size:10pt;color:#000000;font-family:tahoma, arial, helvetica, sans-serif;"">Un savant mélange de mes parents a créé ce magnifique bébé 100% parfait.</span></p> <p class=""Corps""><span style=""font-size:10pt;color:#000000;font-family:tahoma, arial, helvetica, sans-serif;"">Idée cadeau de naissance original qui fera plaisir aux parents</span></p>";;"body 100% parfait";"cadeau naissance"
